{
  "schema_version": "1.0",
  "approval_id": "approval_example-support-101",
  "scope": "EXACT",
  "approver_ref": "fictional-candidate",
  "issued_at": "2099-01-01T00:00:00Z",
  "expires_at": "2099-01-01T00:15:00Z",
  "bindings": [
    {
      "application_id": "app_example-support-101",
      "version": 1,
      "candidate_id": "cand_jordan-example",
      "job_id": "job_example-support-101",
      "channel": "MANUAL",
      "sender_account_ref": null,
      "destination": "Example Systems careers portal",
      "payload_digest": "a38625c4d80c0f35b7c74ae8075d02bb37a1c3d80ce0a16cd54d834830175fe2",
      "artifact_hashes": [
        "6a3bf9d043b5e78556e2155eb7aa4cfefbac72295367b99156d4bdaba3b21553"
      ],
      "claim_ledger_digest": "574d6efee74e4253f0ab41f166fed52fe01c30d278584863cb72014b260b92de"
    }
  ]
}
